{
  "locale": {
    "default": "zh",
    "supported": [
      "zh",
      "en"
    ]
  },
  "content": {
    "hero": {
      "zh": "一次空间扫描，解释完整结构。",
      "en": "One spatial scan explains the complete structure."
    },
    "intro": {
      "zh": "首屏只用 3D 解释完整拱形捕获；随后页面回到价格、规格和证据。",
      "en": "The hero uses 3D only to explain full-arch capture; pricing, specifications, and evidence then return to ordinary document flow."
    },
    "chapters": [
      {
        "id": "01",
        "title": {
          "zh": "在首屏理解整体结构。",
          "en": "Understand the complete structure in the hero."
        },
        "body": {
          "zh": "连续拱形比一组孤立图片更清楚地解释捕获范围。",
          "en": "A continuous arch explains capture coverage more clearly than isolated images."
        }
      },
      {
        "id": "02",
        "title": {
          "zh": "所有购买信息保持普通可读。",
          "en": "Keep every buying fact ordinarily readable."
        },
        "body": {
          "zh": "扫描范围、精度、时间、兼容性和维护条款都保留在标准文档中。",
          "en": "Coverage, accuracy, time, compatibility, and service terms remain in a standard document."
        }
      }
    ],
    "items": [
      {
        "label": "CAPTURE",
        "value": "14 s",
        "note": {
          "zh": "完成一次全结构捕获",
          "en": "One full-structure capture"
        }
      },
      {
        "label": "ACCURACY",
        "value": "24 μm",
        "note": {
          "zh": "重复测量的中位误差",
          "en": "Median repeat measurement error"
        }
      },
      {
        "label": "FORMAT",
        "value": "STL / PLY",
        "note": {
          "zh": "开放输出格式",
          "en": "Open output formats"
        }
      },
      {
        "label": "WARRANTY",
        "value": "36 months",
        "note": {
          "zh": "标准服务周期",
          "en": "Standard service period"
        }
      }
    ]
  },
  "assets": {},
  "motion": {
    "desktop": {},
    "mobile": {},
    "reduced": "stable-states"
  }
}
